{
  "legal_person_name": "Teemun Tomaatit Oy",
  "legal_person_id": "FIHPR.2468135-7",
  "legal_form_type": "Oy",
  "registration_member_state": "FI",
  "registered_address": {
    "registered_address_full_address": "Tomaattikuja 7; 33100 Tampere; Finland",
    "registered_address_thoroughfare": "Tomaattikuja",
    "registered_address_locator_designator": "7",
    "registered_address_post_code": "33100",
    "registered_address_post_name": "Tampere",
    "registered_address_admin_unit_level_1": "Finland",
    "registered_address_admin_unit_level_2": "Pirkanmaa"
  },
  "registration_date": "2020-03-15",
  "share_capital": "EUR 2500",
  "legal_person_status": "active",
  "legal_person_activity": [
    "01.13",
    "46.31"
  ],
  "contact_point": {
    "contact_email": "info@teemuntomaatit.example",
    "contact_page": "https://teemuntomaatit.example"
  },
  "legal_representative": [
    {
      "legal_representative_natural_person": {
        "legal_representative_natural_person_identifier": "FI-PID-TT-19910412",
        "legal_representative_natural_person_full_name": "Teemu Testi",
        "legal_representative_natural_person_date_of_birth": "1991-04-12",
        "legal_representative_natural_person_nationality": "FI"
      },
      "signatory_rule": "sole"
    }
  ]
}